[
  {
    "id": "trd_001",
    "runId": "run_001",
    "symbol": "RELIANCE",
    "exchange": "NSE",
    "segment": "equity_intraday",
    "side": "buy",
    "qty": 50,
    "entryAt": "2026-06-02T04:00:00Z",
    "entryPricePaise": 290000,
    "exitAt": "2026-06-02T05:30:00Z",
    "exitPricePaise": 295000,
    "grossPnlPaise": 250000,
    "charges": {
      "brokeragePaise": 4000,
      "sttPaise": 2500,
      "exchangeTxnPaise": 500,
      "sebiFeePaise": 15,
      "stampDutyPaise": 450,
      "gstPaise": 810,
      "dpPaise": 0,
      "totalPaise": 8275
    },
    "netPnlPaise": 241725
  },
  {
    "id": "trd_002",
    "runId": "run_001",
    "symbol": "TCS",
    "exchange": "NSE",
    "segment": "equity_intraday",
    "side": "sell",
    "qty": 30,
    "entryAt": "2026-06-05T04:15:00Z",
    "entryPricePaise": 380000,
    "exitAt": "2026-06-05T08:00:00Z",
    "exitPricePaise": 374000,
    "grossPnlPaise": 180000,
    "charges": {
      "brokeragePaise": 4000,
      "sttPaise": 1900,
      "exchangeTxnPaise": 400,
      "sebiFeePaise": 12,
      "stampDutyPaise": 350,
      "gstPaise": 792,
      "dpPaise": 0,
      "totalPaise": 7454
    },
    "netPnlPaise": 172546
  },
  {
    "id": "trd_003",
    "runId": "run_001",
    "symbol": "INFY",
    "exchange": "NSE",
    "segment": "equity_intraday",
    "side": "buy",
    "qty": 40,
    "entryAt": "2026-06-09T04:30:00Z",
    "entryPricePaise": 150000,
    "exitAt": "2026-06-09T09:15:00Z",
    "exitPricePaise": 147500,
    "grossPnlPaise": -100000,
    "charges": {
      "brokeragePaise": 4000,
      "sttPaise": 1200,
      "exchangeTxnPaise": 300,
      "sebiFeePaise": 8,
      "stampDutyPaise": 240,
      "gstPaise": 774,
      "dpPaise": 0,
      "totalPaise": 6522
    },
    "netPnlPaise": -106522
  },
  {
    "id": "trd_004",
    "runId": "run_001",
    "symbol": "RELIANCE",
    "exchange": "NSE",
    "segment": "equity_intraday",
    "side": "buy",
    "qty": 50,
    "entryAt": "2026-06-12T05:00:00Z",
    "entryPricePaise": 292000,
    "exitAt": "2026-06-12T07:30:00Z",
    "exitPricePaise": 296000,
    "grossPnlPaise": 200000,
    "charges": {
      "brokeragePaise": 4000,
      "sttPaise": 2500,
      "exchangeTxnPaise": 500,
      "sebiFeePaise": 15,
      "stampDutyPaise": 450,
      "gstPaise": 810,
      "dpPaise": 0,
      "totalPaise": 8275
    },
    "netPnlPaise": 191725
  },
  {
    "id": "trd_005",
    "runId": "run_002",
    "symbol": "HDFCBANK",
    "exchange": "NSE",
    "segment": "equity_intraday",
    "side": "buy",
    "qty": 60,
    "entryAt": "2026-08-17T04:00:00Z",
    "entryPricePaise": 160000,
    "exitAt": "2026-08-17T06:00:00Z",
    "exitPricePaise": 164000,
    "grossPnlPaise": 240000,
    "charges": {
      "brokeragePaise": 4000,
      "sttPaise": 2000,
      "exchangeTxnPaise": 400,
      "sebiFeePaise": 10,
      "stampDutyPaise": 300,
      "gstPaise": 792,
      "dpPaise": 0,
      "totalPaise": 7502
    },
    "netPnlPaise": 232498
  },
  {
    "id": "trd_006",
    "runId": "run_002",
    "symbol": "ICICIBANK",
    "exchange": "NSE",
    "segment": "equity_intraday",
    "side": "sell",
    "qty": 50,
    "entryAt": "2026-08-20T04:30:00Z",
    "entryPricePaise": 115000,
    "exitAt": "2026-08-20T09:00:00Z",
    "exitPricePaise": 117000,
    "grossPnlPaise": -100000,
    "charges": {
      "brokeragePaise": 4000,
      "sttPaise": 1200,
      "exchangeTxnPaise": 300,
      "sebiFeePaise": 8,
      "stampDutyPaise": 200,
      "gstPaise": 774,
      "dpPaise": 0,
      "totalPaise": 6482
    },
    "netPnlPaise": -106482
  },
  {
    "id": "trd_007",
    "runId": "run_002",
    "symbol": "TCS",
    "exchange": "NSE",
    "segment": "equity_intraday",
    "side": "buy",
    "qty": 25,
    "entryAt": "2026-08-24T05:15:00Z",
    "entryPricePaise": 400000,
    "exitAt": "2026-08-24T08:30:00Z",
    "exitPricePaise": 408000,
    "grossPnlPaise": 200000,
    "charges": {
      "brokeragePaise": 4000,
      "sttPaise": 2000,
      "exchangeTxnPaise": 400,
      "sebiFeePaise": 10,
      "stampDutyPaise": 300,
      "gstPaise": 792,
      "dpPaise": 0,
      "totalPaise": 7502
    },
    "netPnlPaise": 192498
  },
  {
    "id": "trd_008",
    "runId": "run_002",
    "symbol": "INFY",
    "exchange": "NSE",
    "segment": "equity_intraday",
    "side": "buy",
    "qty": 50,
    "entryAt": "2026-08-28T04:45:00Z",
    "entryPricePaise": 160000,
    "exitAt": "2026-08-28T07:15:00Z",
    "exitPricePaise": 163000,
    "grossPnlPaise": 150000,
    "charges": {
      "brokeragePaise": 4000,
      "sttPaise": 1600,
      "exchangeTxnPaise": 350,
      "sebiFeePaise": 9,
      "stampDutyPaise": 250,
      "gstPaise": 783,
      "dpPaise": 0,
      "totalPaise": 6992
    },
    "netPnlPaise": 143008
  }
]
